{
  "$schema": "https://json-schema.org/draft/2020-12/schema",
  "$id": "https://shuxueshuo.local/schemas/lesson-data.schema.json",
  "title": "LessonData",
  "type": "object",
  "required": ["meta", "problem", "steps", "policies", "stepLabels"],
  "properties": {
    "meta": {
      "type": "object",
      "required": ["id", "outputPath", "pageTitle", "pageDescription", "breadcrumbTitle"],
      "properties": {
        "id":              { "type": "string" },
        "outputPath":      { "type": "string", "description": "相对仓库根目录的 HTML 输出路径" },
        "pageTitle":       { "type": "string" },
        "pageDescription": { "type": "string" },
        "breadcrumbTitle": { "type": "string" },
        "breadcrumbLabel": { "type": "string", "description": "题页顶部返回题库入口的文字，默认题库导航" },
        "breadcrumbPath":  { "type": "string", "description": "相对仓库根目录的题库页面路径，默认 site/nav/index.html" },
        "classification": {
          "type": "object",
          "description": "知识库分类：pattern 是主题型标签，methods 是本题使用的解题方法 ID 列表",
          "required": ["pattern", "methods"],
          "properties": {
            "pattern": { "type": "string" },
            "methods": {
              "type": "array",
              "items": { "type": "string" }
            }
          },
          "additionalProperties": false
        },
        "curriculum": {
          "type": "object",
          "description": "高中教材路径与题组元数据；不代替题库 chapter/section 分类",
          "required": ["chapterLabel", "sectionLabel", "subsectionLabel", "groupId", "groupLabel"],
          "properties": {
            "chapterLabel": { "type": "string" },
            "sectionLabel": { "type": "string" },
            "subsectionLabel": { "type": "string" },
            "groupId": { "type": "string" },
            "groupLabel": { "type": "string" }
          },
          "additionalProperties": false
        }
      }
    },
    "problem": {
      "type": "object",
      "required": ["lines"],
      "properties": {
        "summary": { "type": "string", "description": "一行摘要，显示在题目卡片折叠状态" },
        "source": { "type": "string", "description": "原题中印刷的考试、学校或教材来源" },
        "keyPoints": {
          "type": "object",
          "description": "可选的解题要点提示，编译后显示在题目与步骤之间；仅用于概括方法框架，不提前给出答案",
          "required": ["title", "items"],
          "properties": {
            "title": { "type": "string" },
            "lead": { "type": "string" },
            "items": {
              "type": "array",
              "minItems": 1,
              "maxItems": 4,
              "items": { "type": "string", "minLength": 1, "description": "允许使用 \\(R_f\\subseteq B\\)、\\(y=\\frac{2x}{3}\\)、\\(\\sqrt{3x+11}\\) 形式的安全行内数学标记" }
            }
          },
          "additionalProperties": false
        },
        "lines": {
          "type": "array",
          "description": "题目内容列表，由编译脚本拼成 HTML，不要内联 HTML 标签",
          "items": {
            "oneOf": [
              {
                "type": "object",
                "description": "普通题目行",
                "required": ["text"],
                "properties": {
                  "text": { "type": "string" }
                },
                "additionalProperties": false
              },
              {
                "type": "object",
                "description": "带答案 chip 的题目行",
                "required": ["text", "answerId", "answer"],
                "properties": {
                  "text":     { "type": "string" },
                  "answerId": { "type": "string", "description": "DOM id，如 answerI" },
                  "answer":   { "type": "string", "description": "答案文字，如 答案：C＝（6，√3）" }
                },
                "additionalProperties": false
              },
              {
                "type": "object",
                "description": "粗体小标题行，如 原题图形",
                "required": ["heading"],
                "properties": {
                  "heading": { "type": "string" }
                },
                "additionalProperties": false
              },
              {
                "type": "object",
                "description": "原题图形组（SVG 占位符列表）",
                "required": ["figures"],
                "properties": {
                  "ariaLabel": { "type": "string" },
                  "figures": {
                    "type": "array",
                    "items": {
                      "type": "object",
                      "required": ["id"],
                      "properties": {
                        "id":        { "type": "string", "description": "SVG 元素 id，与 geometry-spec.originalFigures 对应" },
                        "title":     { "type": "string", "description": "图名（可选）；省略或为空字符串时不显示标题行" },
                        "ariaLabel": { "type": "string" },
                        "caption":   { "type": "string", "description": "图下方的说明文字（可选）；省略或为空时不显示" }
                      }
                    }
                  }
                },
                "additionalProperties": false
              }
            ]
          }
        }
      }
    },
    "ui": {
      "type": "object",
      "properties": {
        "legend": {
          "type": "array",
          "description": "图例项，由编译脚本生成 legendHtml，不要写 HTML",
          "items": {
            "type": "object",
            "required": ["colorVar", "label"],
            "properties": {
              "colorVar": { "type": "string", "description": "CSS 变量名（不含 -- 前缀），如 paper / fold / overlap" },
              "label":    { "type": "string" }
            },
            "additionalProperties": false
          }
        },
        "sliderLabel":      { "type": "string" },
        "paramLabelPrefix": { "type": "string" },
        "linkedParameter": {
          "type": "object",
          "description": "滑块旁同步显示的派生参数，例如 x₀ 改变时联动显示 a",
          "required": ["name", "label"],
          "properties": {
            "name": { "type": "string" },
            "label": { "type": "string" },
            "precision": { "type": "integer", "minimum": 0, "maximum": 8 }
          },
          "additionalProperties": false
        },
        "goToProblemMode":  { "type": "string", "enum": ["doubleScroll", "smooth"] },
        "groupTitles":      { "type": "object", "additionalProperties": { "type": "string" } }
      }
    },
    "steps": {
      "type": "array",
      "items": {
        "type": "object",
        "required": ["id", "section", "title", "t", "derive", "box"],
        "properties": {
          "id":      { "type": "string" },
          "section": { "type": "string" },
          "title":   { "type": "string" },
          "t":       { "type": "number" },
          "derive":  { "type": "array" },
          "box":     { "type": "array", "items": { "type": "string" } },
          "showDiagram": { "type": "boolean", "description": "设为 false 时该步骤只显示文字推导，不生成空白图形区域" },
          "hideLegend": { "type": "boolean" },
          "localControls": {
            "type": "object",
            "properties": {
              "values": { "type": "object", "additionalProperties": { "type": "number" } },
              "note": { "type": "string" },
              "controls": {
                "type": "array",
                "items": {
                  "type": "object",
                  "required": ["var", "label", "min", "max"],
                  "properties": {
                    "var": { "type": "string" },
                    "label": { "type": "string" },
                    "min": { "type": "number" },
                    "max": { "type": "number" },
                    "step": { "type": "number" },
                    "scale": { "type": "number" },
                    "prefix": { "type": "string" },
                    "suffix": { "type": "string" },
                    "precision": { "type": "number" },
                    "landmarks": {
                      "type": "array",
                      "items": {
                        "type": "object",
                        "required": ["value", "display", "epsilon"],
                        "properties": {
                          "value": { "type": "number" },
                          "display": { "type": "string" },
                          "epsilon": { "type": "number", "exclusiveMinimum": 0 }
                        },
                        "additionalProperties": false
                      }
                    }
                  },
                  "additionalProperties": false
                }
              }
            },
            "additionalProperties": false
          },
          "minis":   { "type": "array" }
        }
      }
    },
    "policies":   { "type": "object" },
    "stepLabels": { "type": "object" }
  }
}
