{
  "meta": {
    "id": "tj-2026-hongqiao-sanmo-24",
    "outputPath": "site/problems/tj/24/tj-2026-hongqiao-sanmo-24.html",
    "pageTitle": "2026 年天津市红桥区三模第 24 题（菱形平移与重叠面积）",
    "pageDescription": "2026 年天津市红桥区三模第 24 题：菱形 ABCD、等边三角形 OEF 水平平移、线段 GN 与重叠面积 S 的范围。",
    "breadcrumbTitle": "红桥区三模 24 题",
    "classification": {
      "pattern": "moving-point-translation-area",
      "methods": ["translation-overlap-area", "area-piecewise-by-overlap"]
    }
  },
  "problem": {
    "summary": "2026 年天津市红桥区三模第 24 题（菱形平移与重叠面积）",
    "lines": [
      { "text": "（24）（本小题 10 分）在平面直角坐标系中，O 为原点，菱形 ABCD 的顶点 A（√3，0），B（0，1），C（√3，2），等边三角形 OEF 的顶点 E 在第二象限，顶点 F（0，2）。" },
      { "text": "（1）填空：如图①，点 D 的坐标为__________，点 E 的坐标为__________；", "answerId": "answer1", "answer": "答案：D（2√3，1），E（-√3，1）" },
      { "text": "（2）将 △OEF 沿水平方向向右平移，得到 △O′E′F′，点 O，E，F 的对应点分别为 O′，E′，F′，设 OO′＝t。" },
      { "text": "① 如图②，当边 O′E′ 与 AD 相交于点 G，边 E′F′ 与 CD 相交于点 H，边 O′F′ 与 CD 相交于点 M，与 AD 相交于点 N，且 △O′E′F′ 与菱形 ABCD 重叠部分为五边形时，试用含有 t 的式子表示线段 GN 的长，并直接写出 t 的取值范围；", "answerId": "answer2a", "answer": "答案：GN＝√3t/3-1，√3＜t＜2√3" },
      { "text": "② 设平移后重叠部分的面积为 S，当 √3/2≤t≤5√3/2 时，求 S 的取值范围（直接写出结果即可）。", "answerId": "answer2b", "answer": "答案：√3/8≤S≤√3" },
      { "heading": "原题图形" },
      { "ariaLabel": "原题图 1 和图 2", "figures": [
        { "id": "originalFigure1", "title": "图 1", "ariaLabel": "图 1：菱形 ABCD 与原始等边三角形 OEF" },
        { "id": "originalFigure2", "title": "图 2", "ariaLabel": "图 2：平移后三角形与菱形重叠为五边形" }
      ] }
    ]
  },
  "ui": {
    "legend": [
      { "colorVar": "paper", "label": "固定菱形 ABCD" },
      { "colorVar": "fold", "label": "平移三角形 O′E′F′" },
      { "colorVar": "overlap", "label": "当前重叠区域 S" }
    ],
    "sliderLabel": "平移距离 · t＝OO′",
    "paramLabelPrefix": "t=",
    "goToProblemMode": "doubleScroll",
    "groupTitles": {
      "第（1）问": "第（1）问 坐标",
      "第（2）①问": "第（2）① GN 与 t 范围",
      "第（2）②问": "第（2）② S 范围"
    }
  },
  "steps": [
    {
      "id": "q1s1",
      "section": "第（1）问",
      "title": "第1步：由菱形平行关系求 D 坐标",
      "t": 0,
      "derive": [
        ["∵", "菱形 ABCD 是平行四边形"],
        ["∴", "AD∥BC，且 AD＝BC"],
        ["∵", "从 B（0，1）到 C（√3，2），横坐标增加 √3，纵坐标增加 1"],
        ["∴", "从 A（√3，0）到 D 也横向增加 √3，纵向增加 1"],
        ["∴", "D（2√3，1）"]
      ],
      "box": ["D（2√3，1）"]
    },
    {
      "id": "q1s2",
      "section": "第（1）问",
      "title": "第2步：由等边三角形高求 E 坐标",
      "t": 0,
      "derive": [
        ["∵", "O（0，0），F（0，2）"],
        ["∴", "OF＝2，且 OF 在 y 轴上"],
        ["∵", "△OEF 是等边三角形"],
        ["∴", "E 到 OF 的垂足是 OF 的中点（0，1）"],
        ["∵", "边长为 2 的等边三角形高为 √3"],
        ["∵", "E 在第二象限"],
        ["∴", "E（-√3，1）"]
      ],
      "box": ["E（-√3，1）"]
    },
    {
      "id": "q2a1",
      "section": "第（2）①问",
      "title": "第1步：由等腰三角形 AGO′ 求 AG",
      "t": 2.598076211353316,
      "derive": [
        ["∵", "A（√3，0），O′（t，0）"],
        ["∴", "AO′＝t-√3"],
        ["∵", "AD 与 x 轴所成角为 30°，O′E′ 与 O′A 所成角也为 30°"],
        ["∴", "∠GAO′＝∠GO′A＝30°"],
        ["∴", "△AGO′ 是等腰三角形，AG＝GO′"],
        ["∵", "等腰三角形 AGO′ 的底边 AO′＝t-√3，底角为 30°"],
        ["∴", "AG＝AO′/√3＝(t-√3)/√3＝√3t/3-1"]
      ],
      "box": ["AG＝√3t/3-1"]
    },
    {
      "id": "q2a2",
      "section": "第（2）①问",
      "title": "第2步：由直角三角形 ANO′ 求 GN",
      "t": 2.598076211353316,
      "derive": [
        ["∵", "O′F′⊥AO′，N 在 O′F′ 上"],
        ["∴", "∠AO′N＝90°"],
        ["∵", "N 在 AD 上，AD 与 x 轴所成角为 30°"],
        ["∴", "∠NAO′＝30°"],
        ["∴", "Rt△ANO′ 中，AN＝AO′/cos30°＝2(t-√3)/√3"],
        ["∴", "GN＝AN-AG"],
        ["∴", "GN＝2(t-√3)/√3-(t-√3)/√3＝√3t/3-1"]
      ],
      "box": ["GN＝√3t/3-1"]
    },
    {
      "id": "q2a3",
      "section": "第（2）①问",
      "title": "第3步：由边界位置求五边形 t 范围",
      "t": 2.598076211353316,
      "derive": [
        ["∵", "左边界：t＝√3 时，O′ 与 A 重合，G、N 都与 A 重合，五边形退化"],
        ["∴", "五边形状态要求 t＞√3"],
        ["∵", "右边界：t＝2√3 时，O′F′ 经过 D，M、N 都与 D 重合，五边形退化"],
        ["∴", "五边形状态要求 t＜2√3"],
        ["∴", "√3＜t＜2√3"]
      ],
      "box": ["GN＝√3t/3-1", "√3＜t＜2√3"],
      "minis": [
        { "title": "t＝√3", "caption": "G、N 与 A 重合，五边形尚未形成。", "t": 1.7320508075688772 },
        { "title": "√3＜t＜2√3", "caption": "重叠部分为五边形 N-G-E′-H-M。", "t": 2.598076211353316 },
        { "title": "t＝2√3", "caption": "M、N 与 D 重合，五边形退化。", "t": 3.4641016151377544 }
      ]
    },
    {
      "id": "q2b1",
      "section": "第（2）②问",
      "title": "第1步：由图形变化判断面积候选",
      "t": 2.598076211353316,
      "derive": [
        ["∵", "√3/2≤t≤√3 时，平移三角形逐渐进入菱形，重叠部分为三角形，面积逐渐增大"],
        ["∵", "t＝√3 时，O′、E′、F′ 分别与 A、B、C 重合，整个 △O′E′F′ 在菱形内"],
        ["∴", "最大值候选为 t＝√3"],
        ["∵", "√3＜t＜2√3 时，重叠部分为五边形，面积逐渐减小"],
        ["∵", "2√3≤t≤5√3/2 时，重叠部分为四边形，并继续缩小"],
        ["∴", "最小值只需比较 t＝√3/2 与 t＝5√3/2"]
      ],
      "box": ["最大值看 t＝√3", "最小值比较 t＝√3/2 与 t＝5√3/2"],
      "minis": [
        { "title": "√3/2≤t≤√3", "caption": "重叠三角形逐渐变大。", "t": 1.299038105676658 },
        { "title": "√3＜t＜2√3", "caption": "五边形阶段逐渐缩小。", "t": 2.598076211353316 },
        { "title": "2√3≤t≤5√3/2", "caption": "右侧四边形继续缩小。", "t": 3.897114317029974 }
      ]
    },
    {
      "id": "q2b2",
      "section": "第（2）②问",
      "title": "第2步：由左端三角形求 S（t=√3/2）",
      "t": 0.8660254037844386,
      "derive": [
        ["∵", "t＝√3/2 时，O′F′ 与 AB、BC 分别交于 P、Q"],
        ["∵", "OO′＝√3/2，PQ 在直线 O′F′ 上"],
        ["∴", "点 B 到 PQ 的垂线段长为 √3/2"],
        ["∵", "P、Q 分别在 BA、BC 上，∠ABC＝60°"],
        ["∴", "△BPQ 是等边三角形"],
        ["∴", "S(√3/2)＝√3/4"]
      ],
      "box": ["S(√3/2)＝√3/4"]
    },
    {
      "id": "q2b3",
      "section": "第（2）②问",
      "title": "第3步：由完整等边三角形求最大面积",
      "t": 1.7320508075688772,
      "derive": [
        ["∵", "t＝√3 时，O′＝A，E′＝B，F′＝C"],
        ["∴", "重叠部分就是整个 △O′E′F′"],
        ["∵", "△O′E′F′ 是边长为 2 的等边三角形"],
        ["∴", "S(√3)＝√3"]
      ],
      "box": ["S 的最大值为 √3"]
    },
    {
      "id": "q2b4",
      "section": "第（2）②问",
      "title": "第4步：由右端小菱形求 S（t=5√3/2）",
      "t": 4.330127018922193,
      "derive": [
        ["∵", "t＝5√3/2 时，重叠部分是四边形 G-E′-H-D"],
        ["作", "连接 E′D 并延长，交 O′F′ 于 K"],
        ["∵", "E′K⊥O′F′，OO′＝5√3/2，D 到 y 轴的水平距离为 2√3"],
        ["∴", "DK＝5√3/2-2√3＝√3/2"],
        ["∵", "E′K＝√3"],
        ["∴", "E′D＝E′K-DK＝√3/2"],
        ["∵", "四边形 G-E′-H-D 是菱形，且 ∠GE′H＝60°"],
        ["∴", "S(5√3/2)＝(E′D)^2/(2√3)＝√3/8"]
      ],
      "box": ["S(5√3/2)＝√3/8"]
    },
    {
      "id": "q2b5",
      "section": "第（2）②问",
      "title": "第5步：由候选值合并 S 范围",
      "t": 1.7320508075688772,
      "derive": [
        ["∵", "S(√3/2)＝√3/4"],
        ["∵", "S(5√3/2)＝√3/8"],
        ["∴", "最小值为 √3/8"],
        ["∵", "最大值为 S(√3)＝√3"],
        ["∴", "√3/8≤S≤√3"]
      ],
      "box": ["√3/8≤S≤√3"],
      "minis": [
        { "title": "左端", "caption": "t＝√3/2 时，S＝√3/4。", "t": 0.8660254037844386 },
        { "title": "最大", "caption": "t＝√3 时，整个等边三角形在菱形内，S＝√3。", "t": 1.7320508075688772 },
        { "title": "右端", "caption": "t＝5√3/2 时，小菱形面积为 √3/8。", "t": 4.330127018922193 }
      ]
    }
  ],
  "policies": {
    "q1s1": { "movable": false, "range": [0, 0] },
    "q1s2": { "movable": false, "range": [0, 0] },
    "q2a1": { "movable": true, "range": [1.733, 3.463], "step": 0.001 },
    "q2a2": { "movable": true, "range": [1.733, 3.463], "step": 0.001 },
    "q2a3": { "movable": true, "range": [1.7320508075688772, 3.4641016151377544], "step": 0.001 },
    "q2b1": { "movable": true, "range": [0.8660254037844386, 4.330127018922193], "step": 0.001 },
    "q2b2": { "movable": false, "range": [0.8660254037844386, 0.8660254037844386] },
    "q2b3": { "movable": false, "range": [1.7320508075688772, 1.7320508075688772] },
    "q2b4": { "movable": false, "range": [4.330127018922193, 4.330127018922193] },
    "q2b5": { "movable": true, "range": [0.8660254037844386, 4.330127018922193], "step": 0.001 }
  },
  "stepLabels": {
    "q1s1": "1 求D坐标",
    "q1s2": "2 求E坐标",
    "q2a1": "1 等腰△求AG",
    "q2a2": "2 直角△求GN",
    "q2a3": "3 判五边形范围",
    "q2b1": "1 判断面积候选",
    "q2b2": "2 左端最小面积",
    "q2b3": "3 最大面积",
    "q2b4": "4 右端最小面积",
    "q2b5": "5 合并范围"
  }
}
