{
  "meta": {
    "id": "tj-2026-heping-ermo-24",
    "outputPath": "site/problems/tj/24/tj-2026-heping-ermo-24.html",
    "pageTitle": "2026 年天津市和平区二模 第 24 题（梯形折叠与重叠面积）",
    "pageDescription": "2026 天津市和平区二模第 24 题：梯形 OABC 折叠，求 A、B 坐标、O′E 表达式和重叠面积 S 的范围。",
    "breadcrumbTitle": "2026 天津市和平区二模 第 24 题",
    "classification": {
      "pattern": "moving-point-folding-area",
      "methods": ["folding-overlap-area", "area-piecewise-by-overlap"]
    }
  },
  "problem": {
    "summary": "第 24 题（2026 天津市和平区二模）梯形折叠与重叠面积",
    "lines": [
      { "text": "（24）（本小题 10 分）将一个梯形纸片 OABC 放置在平面直角坐标系中，点 O(0,0)，点 C(5,0)，顶点 A，B 都在第一象限，AB∥OC，OA=BC=2，∠BCO=60°。" },
      { "text": "（Ⅰ）填空：如图①，点 A 的坐标为________，点 B 的坐标为________；", "answerId": "answerI", "answer": "答案：A(1，√3)，B(4，√3)" },
      { "text": "（Ⅱ）若点 P 在边 OC 上（点 P 不与点 O，C 重合），过点 P 作直线 l∥BC，沿直线 l 折叠该纸片，折叠后点 O 的对应点为 O′。设 OP=t。" },
      { "text": "① 如图②，若直线 l 与边 AB 相交于点 Q，点 A 的对应点为 A′，当折叠后四边形 PO′A′Q 与梯形 OABC 重叠部分为四边形时，O′P 与 BC 相交于点 E。试用含有 t 的式子表示线段 O′E，并直接写出 t 的取值范围；", "answerId": "answerII1", "answer": "答案：O′E=2t-5，3＜t＜5" },
      { "text": "② 设折叠后重叠部分的面积为 S，当 3/2≤t≤9/2 时，求 S 的取值范围（直接写出结果即可）。", "answerId": "answerII2", "answer": "答案：7√3/16≤S≤√3" },
      { "heading": "原题图形" },
      { "ariaLabel": "原题图 1 和图 2", "figures": [
        { "id": "originalFigure1", "title": "图 1", "ariaLabel": "图 1：固定梯形 OABC" },
        { "id": "originalFigure2", "title": "图 2", "ariaLabel": "图 2：折叠后重叠部分为四边形" }
      ] }
    ]
  },
  "ui": {
    "legend": [
      { "colorVar": "paper", "label": "固定梯形 OABC" },
      { "colorVar": "fold", "label": "折叠后图形" },
      { "colorVar": "overlap", "label": "重叠区域 S" }
    ],
    "sliderLabel": "P 点位置 · t＝OP",
    "paramLabelPrefix": "t=",
    "goToProblemMode": "doubleScroll",
    "groupTitles": {
      "第（Ⅰ）问": "第（Ⅰ）问 坐标填空",
      "第（Ⅱ）①问": "第（Ⅱ）①问 O′E 与 t 范围",
      "第（Ⅱ）②问": "第（Ⅱ）②问 面积 S 的取值范围"
    }
  },
  "steps": [
    {
      "id": "q1s1",
      "section": "第（Ⅰ）问",
      "title": "第1步：由等腰梯形底角求 A 坐标",
      "t": 3,
      "derive": [
        ["∵", "AB∥OC，OA=BC"],
        ["∴", "梯形 OABC 是等腰梯形"],
        ["∴", "∠AOC=∠BCO=60°"],
        ["∵", "OA=2，O(0,0)，A 在第一象限"],
        ["∴", "x_A=2cos60°=1，y_A=2sin60°=√3"]
      ],
      "box": ["A(1，√3)"]
    },
    {
      "id": "q1s2",
      "section": "第（Ⅰ）问",
      "title": "第2步：由 A、C 坐标求 B 坐标",
      "t": 3,
      "derive": [
        ["∵", "A(1，√3)，C(5,0)"],
        ["∵", "BC=2，∠BCO=60°"],
        ["∴", "从 C 到 B 的水平距离为 2cos60°=1"],
        ["∴", "B 的横坐标为 5-1=4，纵坐标与 A 相同为 √3"],
        ["∴", "B(4，√3)"]
      ],
      "box": ["A(1，√3)", "B(4，√3)"]
    },
    {
      "id": "q2a1s1",
      "section": "第（Ⅱ）①问",
      "title": "第1步：由等边三角形求 O′E",
      "t": 3.6,
      "derive": [
        ["∵", "OP=t，P 在 OC 上"],
        ["∴", "P(t,0)"],
        ["∵", "折叠保持长度不变"],
        ["∴", "O′P=OP=t"],
        ["∵", "O′P 与 PC 的夹角为 60°，BC 与 CP 的夹角为 60°"],
        ["∴", "△PCE 是等边三角形"],
        ["∴", "PE=PC=5-t"],
        ["∴", "O′E=O′P-PE=t-(5-t)=2t-5"]
      ],
      "box": ["O′P=t", "PE=PC=5-t", "O′E=2t-5"]
    },
    {
      "id": "q2a1s2",
      "section": "第（Ⅱ）①问",
      "title": "第2步：由边界位置判断四边形范围",
      "t": 4,
      "derive": [
        ["∵", "当 E 与 B 重合时，四边形重叠刚开始形成"],
        ["∵", "此时 PE=PB=PC=BC=2"],
        ["∴", "左边界为 t=3"],
        ["∵", "当 P 与 C 重合、Q 与 B 重合时，重叠四边形退化"],
        ["∴", "右边界为 t=5"],
        ["∴", "重叠部分为四边形时，3＜t＜5"]
      ],
      "box": ["左边界：t=3", "右边界：t=5", "3＜t＜5"],
      "minis": [
        { "title": "t=3", "caption": "E 与 B 重合，四边形尚未形成。", "t": 3 },
        { "title": "3＜t＜5", "caption": "重叠部分为四边形 PEBQ。", "t": 4 },
        { "title": "t=5", "caption": "P 与 C 重合，四边形退化。", "t": 5 }
      ]
    },
    {
      "id": "q2a2s1",
      "section": "第（Ⅱ）②问",
      "title": "第1步：由折叠位置判断面积分段",
      "t": 2.5,
      "derive": [
        ["∵", "3/2≤t≤2 时，折痕 l 交 OA 于点 R，重叠部分是三角形"],
        ["∴", "此时 S 随 t 增大而增大"],
        ["∵", "2≤t≤3 时，重叠部分被梯形上边截成等高三角形"],
        ["∴", "此时 S 保持为 √3"],
        ["∵", "3≤t≤9/2 时，重叠部分为四边形并逐渐缩小"],
        ["∴", "最大值看 2≤t≤3，最小值需要比较 t=3/2 和 t=9/2"]
      ],
      "box": ["最大值：2≤t≤3", "最小值候选：t=3/2、t=9/2"],
      "minis": [
        { "title": "3/2≤t≤2", "caption": "重叠部分是三角形，面积增大。", "t": 1.7 },
        { "title": "2≤t≤3", "caption": "重叠面积保持为 √3。", "t": 2.5 },
        { "title": "3≤t≤9/2", "caption": "重叠四边形逐渐缩小。", "t": 4.2 }
      ]
    },
    {
      "id": "q2a2s2",
      "section": "第（Ⅱ）②问",
      "title": "第2步：由 t=3/2 求左端候选最小值",
      "t": 1.5,
      "derive": [
        ["∵", "3/2≤t≤2 时，折痕与 OA 交于 R"],
        ["∵", "l∥BC，∠AOC=60°，∠OPR=60°"],
        ["∴", "△OPR 是等边三角形"],
        ["∵", "折叠前 △OPR 与折叠后重叠三角形全等"],
        ["∴", "S=S△OPR"],
        ["∵", "OP=t，R 到 x 轴的高为 √3t/2"],
        ["∴", "S=1/2·t·√3t/2=√3t²/4"],
        ["∴", "t=3/2 时，S=9√3/16"]
      ],
      "box": ["S=√3t²/4", "t=3/2 时 S=9√3/16"]
    },
    {
      "id": "q2a2s3",
      "section": "第（Ⅱ）②问",
      "title": "第3步：由等底等高判断最大值",
      "t": 2.5,
      "derive": [
        ["∵", "2≤t≤3 时，折后重叠部分的底边在 AB 上，高为 √3"],
        ["∵", "折叠后的斜边被 AB 截出的水平长度为 2"],
        ["∴", "S=1/2·2·√3=√3"],
        ["∴", "S 的最大值为 √3"]
      ],
      "box": ["2≤t≤3 时 S=√3", "S_max=√3"]
    },
    {
      "id": "q2a2s4",
      "section": "第（Ⅱ）②问",
      "title": "第4步：由平行四边形差求右端候选最小值",
      "t": 4.5,
      "derive": [
        ["∵", "3≤t≤9/2 时，重叠四边形随 t 增大而缩小"],
        ["∴", "右端候选值在 t=9/2 处取得"],
        ["∵", "t=9/2 时，P(9/2,0)，E(19/4,√3/4)，Q(7/2,√3)，B(4,√3)"],
        ["∴", "重叠四边形为 PEBQ"],
        ["∵", "四边形 BQPC 是平行四边形，PC=BQ=1/2，高为 √3"],
        ["∴", "S_BQPC=√3/2"],
        ["∵", "△PEC 是等边三角形，边长 PC=1/2"],
        ["∴", "S_△PEC=√3/16"],
        ["∴", "S=S_BQPC-S_△PEC=7√3/16"]
      ],
      "box": ["S_BQPC=√3/2", "S_△PEC=√3/16", "右端候选：7√3/16"]
    },
    {
      "id": "q2a2s5",
      "section": "第（Ⅱ）②问",
      "title": "第5步：由最大最小值合并范围",
      "t": 4.5,
      "derive": [
        ["∵", "在 3/2≤t≤2 时，S 从 9√3/16 增大到 √3"],
        ["∵", "在 2≤t≤3 时，S=√3"],
        ["∵", "在 3≤t≤9/2 时，S 从 √3 减小到 7√3/16"],
        ["∵", "7√3/16＜9√3/16"],
        ["∴", "S 的最小值为 7√3/16，最大值为 √3"]
      ],
      "box": ["7√3/16≤S≤√3"]
    }
  ],
  "policies": {
    "q1s1": { "movable": false, "range": [3, 3] },
    "q1s2": { "movable": false, "range": [3, 3] },
    "q2a1s1": { "movable": true, "range": [3.001, 4.999], "step": 0.001 },
    "q2a1s2": { "movable": true, "range": [3, 5], "step": 0.001 },
    "q2a2s1": { "movable": true, "range": [1.5, 4.5], "step": 0.001 },
    "q2a2s2": { "movable": false, "range": [1.5, 1.5] },
    "q2a2s3": { "movable": true, "range": [2, 3], "step": 0.001 },
    "q2a2s4": { "movable": false, "range": [4.5, 4.5] },
    "q2a2s5": { "movable": true, "range": [1.5, 4.5], "step": 0.001 }
  },
  "stepLabels": {
    "q1s1": "1 求A坐标",
    "q1s2": "2 求B坐标",
    "q2a1s1": "1 求O′E",
    "q2a1s2": "2 判范围",
    "q2a2s1": "1 判面积分段",
    "q2a2s2": "2 求左端候选",
    "q2a2s3": "3 判最大值",
    "q2a2s4": "4 求右端候选",
    "q2a2s5": "5 合并范围"
  }
}
